{
  "$schema": "https://raw.githubusercontent.com/Seeridia/tokenc/main/benchmarks/benchmark-report.v1.schema.json",
  "schemaVersion": 1,
  "suite": {
    "name": "tokenc-compiler",
    "version": 1
  },
  "generatedAt": "2026-08-31T16:29:16.773Z",
  "source": {
    "commit": "07f44907fde16c9b136b9300e6b94fd1fe52ad46",
    "dirty": true
  },
  "environment": {
    "node": "v24.20.0",
    "v8": "13.6.233.17-node.53",
    "platform": "darwin",
    "arch": "arm64",
    "cpuModel": "Apple M4",
    "logicalCores": 10,
    "totalMemoryBytes": 17179869184
  },
  "methodology": {
    "profile": "baseline",
    "warmupRuns": 5,
    "sampleRuns": 20,
    "memorySampleRuns": 3,
    "percentileMethod": "linear-r7",
    "clock": "performance.now",
    "concurrency": 1,
    "fixturePreparationIncluded": false,
    "ioIncluded": false,
    "timingIsolation": "one-process-per-case",
    "memoryIsolation": "one-process-per-sample"
  },
  "cases": [
    {
      "id": "m2/unchanged/layered-1200",
      "name": "M2 unchanged two-Snapshot baseline",
      "group": "change-intelligence",
      "fixture": {
        "kind": "synthetic",
        "version": "m2-00-v1",
        "sha256": "sha256:020dc7eed33ef62aeffa37ad14f973f924bf51f4a67d0215e69090515e1e5446",
        "files": 6,
        "bytes": 231472,
        "description": "Two identical 1,200-token layered revisions with two Context dimensions",
        "parameters": {
          "tokensPerRevision": 1200,
          "dimensions": 2
        }
      },
      "operation": {
        "cacheState": "compiler-cold-runtime-warm",
        "outputTarget": "backend-plan",
        "ioIncluded": false,
        "kind": "change-intelligence-unchanged"
      },
      "validation": {
        "compilationSuccess": true,
        "matchesExpected": true,
        "semanticSha256": "sha256:816af979e7eaf0a15508acce469eff31a0424b2fd255f46ed8a4b7d3d3602250",
        "diagnostics": {}
      },
      "timeSamples": [
        {
          "index": 1,
          "wallMs": 136.47366599999998,
          "stagesMs": {
            "parse": 8.305124999999975,
            "link": 4.372583000000077,
            "graph": 11.295874000000026,
            "check": 0.9739589999999225,
            "resolve": 9.629291999999964,
            "emit": 0,
            "total": 39.93870800000002
          },
          "counters": {
            "tokens": 1200,
            "references": 800,
            "contexts": 3,
            "affectedTokens": null,
            "checkedTokens": null,
            "resolverComputations": 1200,
            "changedTokens": null,
            "recomputedTokens": null,
            "graphTouchedNodes": null,
            "graphTouchedEdges": null,
            "outputFiles": 0,
            "outputBytes": 0,
            "diagnostics": {},
            "contextCycles": {
              "candidateRegions": 0,
              "relevantDimensions": 0,
              "estimatedProjections": 0,
              "estimateSaturated": false,
              "enumeratedProjections": 0,
              "earlyExits": 0,
              "limitHits": 0
            }
          },
          "changeIntelligence": {
            "stagesMs": {
              "snapshotConstruction": 94.28595799999994,
              "impactTraversal": 0.04258299999992232,
              "backendPreparation": 41.83104100000003,
              "reportSerialization": 0.20474999999999
            },
            "counters": {
              "baseTokens": 1200,
              "headTokens": 1200,
              "changedTokens": 0,
              "directlyAffectedTokens": 0,
              "indirectlyAffectedTokens": 0,
              "backendPlans": 2,
              "reportEntries": 0,
              "reportBytes": 144132
            }
          }
        },
        {
          "index": 2,
          "wallMs": 131.76637499999993,
          "stagesMs": {
            "parse": 8.009082999999919,
            "link": 3.6460010000000693,
            "graph": 11.06337499999995,
            "check": 0.8688329999999951,
            "resolve": 9.502666999999974,
            "emit": 0,
            "total": 37.71629200000007
          },
          "counters": {
            "tokens": 1200,
            "references": 800,
            "contexts": 3,
            "affectedTokens": null,
            "checkedTokens": null,
            "resolverComputations": 1200,
            "changedTokens": null,
            "recomputedTokens": null,
            "graphTouchedNodes": null,
            "graphTouchedEdges": null,
            "outputFiles": 0,
            "outputBytes": 0,
            "diagnostics": {},
            "contextCycles": {
              "candidateRegions": 0,
              "relevantDimensions": 0,
              "estimatedProjections": 0,
              "estimateSaturated": false,
              "enumeratedProjections": 0,
              "earlyExits": 0,
              "limitHits": 0
            }
          },
          "changeIntelligence": {
            "stagesMs": {
              "snapshotConstruction": 90.07966600000009,
              "impactTraversal": 0.033875000000080036,
              "backendPreparation": 41.303666999999905,
              "reportSerialization": 0.2166669999999158
            },
            "counters": {
              "baseTokens": 1200,
              "headTokens": 1200,
              "changedTokens": 0,
              "directlyAffectedTokens": 0,
              "indirectlyAffectedTokens": 0,
              "backendPlans": 2,
              "reportEntries": 0,
              "reportBytes": 144132
            }
          }
        },
        {
          "index": 3,
          "wallMs": 132.45225000000005,
          "stagesMs": {
            "parse": 7.869916999999987,
            "link": 4.561999000000014,
            "graph": 11.207167000000254,
            "check": 0.9821669999998903,
            "resolve": 9.357082999999875,
            "emit": 0,
            "total": 39.519791999999825
          },
          "counters": {
            "tokens": 1200,
            "references": 800,
            "contexts": 3,
            "affectedTokens": null,
            "checkedTokens": null,
            "resolverComputations": 1200,
            "changedTokens": null,
            "recomputedTokens": null,
            "graphTouchedNodes": null,
            "graphTouchedEdges": null,
            "outputFiles": 0,
            "outputBytes": 0,
            "diagnostics": {},
            "contextCycles": {
              "candidateRegions": 0,
              "relevantDimensions": 0,
              "estimatedProjections": 0,
              "estimateSaturated": false,
              "enumeratedProjections": 0,
              "earlyExits": 0,
              "limitHits": 0
            }
          },
          "changeIntelligence": {
            "stagesMs": {
              "snapshotConstruction": 91.70270900000014,
              "impactTraversal": 0.03608299999996234,
              "backendPreparation": 40.39429100000007,
              "reportSerialization": 0.19870800000012423
            },
            "counters": {
              "baseTokens": 1200,
              "headTokens": 1200,
              "changedTokens": 0,
              "directlyAffectedTokens": 0,
              "indirectlyAffectedTokens": 0,
              "backendPlans": 2,
              "reportEntries": 0,
              "reportBytes": 144132
            }
          }
        },
        {
          "index": 4,
          "wallMs": 137.59729100000004,
          "stagesMs": {
            "parse": 8.524499999999989,
            "link": 4.142207999999982,
            "graph": 11.809584000000086,
            "check": 0.9774159999999483,
            "resolve": 10.062250000000176,
            "emit": 0,
            "total": 40.34858299999996
          },
          "counters": {
            "tokens": 1200,
            "references": 800,
            "contexts": 3,
            "affectedTokens": null,
            "checkedTokens": null,
            "resolverComputations": 1200,
            "changedTokens": null,
            "recomputedTokens": null,
            "graphTouchedNodes": null,
            "graphTouchedEdges": null,
            "outputFiles": 0,
            "outputBytes": 0,
            "diagnostics": {},
            "contextCycles": {
              "candidateRegions": 0,
              "relevantDimensions": 0,
              "estimatedProjections": 0,
              "estimateSaturated": false,
              "enumeratedProjections": 0,
              "earlyExits": 0,
              "limitHits": 0
            }
          },
          "changeIntelligence": {
            "stagesMs": {
              "snapshotConstruction": 95.13808300000005,
              "impactTraversal": 0.033208000000058746,
              "backendPreparation": 42.08833400000003,
              "reportSerialization": 0.21420800000009876
            },
            "counters": {
              "baseTokens": 1200,
              "headTokens": 1200,
              "changedTokens": 0,
              "directlyAffectedTokens": 0,
              "indirectlyAffectedTokens": 0,
              "backendPlans": 2,
              "reportEntries": 0,
              "reportBytes": 144132
            }
          }
        },
        {
          "index": 5,
          "wallMs": 132.85020899999995,
          "stagesMs": {
            "parse": 7.910250000000133,
            "link": 3.902748999999858,
            "graph": 11.650083999999879,
            "check": 1.0173330000000078,
            "resolve": 9.604207999999971,
            "emit": 0,
            "total": 39.07674999999995
          },
          "counters": {
            "tokens": 1200,
            "references": 800,
            "contexts": 3,
            "affectedTokens": null,
            "checkedTokens": null,
            "resolverComputations": 1200,
            "changedTokens": null,
            "recomputedTokens": null,
            "graphTouchedNodes": null,
            "graphTouchedEdges": null,
            "outputFiles": 0,